Sheet: Sheet1
A1: Bill of Materials
A3: Drawing | B3: INST-1 | C3: INST-2 | D3: INST-3 | E3: INST-4 | F3: LIGHTS-1 | G3: LIGHTS-2 | H3: LIGHTS-3 | I3: TOTAL
A4: 12 AWG Black | E4: 30 | I4: of:=SUM([.A4:.H4]) -> 30
A5: 12 AWG Red | E5: 30 | I5: of:=SUM([.A5:.H5]) -> 30
A6: 18 AWG Black | C6: 5 | F6: 11 | I6: of:=SUM([.A6:.H6]) -> 16
A7: 18 AWG Red | C7: 15 | I7: of:=SUM([.A7:.H7]) -> 15
A8: 18 AWG Yellow | F8: 3 | I8: of:=SUM([.A8:.H8]) -> 3
A9: 20 AWG Black | B9: 6 | G9: 4 | H9: 20 | I9: of:=SUM([.A9:.H9]) -> 30
A10: 20 AWG Blue | G10: 15 | I10: of:=SUM([.A10:.H10]) -> 15
A11: 20 AWG Green | F11: 36 | G11: of:=6+15 -> 21 | I11: of:=SUM([.A11:.H11]) -> 57
A12: 20 AWG Red | B12: 8 | F12: 54 | G12: of:=23+30 -> 53 | H12: 20 | I12: of:=SUM([.A12:.H12]) -> 135
A13: 20 AWG Shielded | F13: 35 | I13: of:=SUM([.A13:.H13]) -> 35
A14: 20 AWG White | B14: 3 | E14: 20 | I14: of:=SUM([.A14:.H14]) -> 23
A15: 20 AWG Yellow | F15: 30 | G15: of:=21+30 -> 51 | I15: of:=SUM([.A15:.H15]) -> 81
A16: 22 AWG Black | B16: 5 | I16: of:=SUM([.A16:.H16]) -> 5
A17: 22 AWG Green | B17: 5 | I17: of:=SUM([.A17:.H17]) -> 5
A18: 22 AWG White | C18: 40 | D18: 15 | I18: of:=SUM([.A18:.H18]) -> 55
A19: 22 AWG White/Blue | C19: 40 | D19: 15 | I19: of:=SUM([.A19:.H19]) -> 55
A20: Faston 12-14 AWG .250 | E20: 4 | I20: of:=SUM([.A20:.H20]) -> 4
A21: Faston 18-22 AWG .250 | B21: 4 | C21: 2 | D21: 6 | E21: 1 | F21: 7 | G21: 4 | H21: 2 | I21: of:=SUM([.A21:.H21]) -> 26
A22: Ring terminal 16-22 #10 | F22: 4 | G22: 2 | I22: of:=SUM([.A22:.H22]) -> 6